PMID,Title,Publication Date,Non-Academic Authors,Corresponding Author Email
39865052,Cutaneous Anthrax: What is the Hallmark?,2024,,Not Available
39863129,Cohort study to evaluate the pattern of analgesic prescription in adult patients undergoing ambulatory surgery.,2025,,Not Available
39862823,Efficient removal of pharmaceuticals from wastewater: Comparative study of three advanced oxidation processes.,2025,,Not Available
39862321,Comparison of the Effectiveness of Paracetamol and Ibuprofen in the Management of Patent Ductus Arteriosus in Preterm Neonates: A Randomized Controlled Trial.,2025,,Not Available
39862135,Prescription of commonly used drugs in patients with functional bowel disorders. A cross-sectional comparison with the general population.,2025,,Not Available
39861106,Multi-Omics and Network-Based Drug Repurposing for Septic Cardiomyopathy.,2025,,Not Available
39859046,Efficacy of Intraoperative Paracetamol and Nefopam Infusions in Addition to Transversus Abdominis Plane Block in Kidney Transplant Recipients.,2025,,Not Available
39857875,Epidemiological and Clinical Characteristics of Pediatric Acute Drug Intoxications: A Retrospective Analysis.,2024,,Not Available
39857177,Clinical Assessment of Puressentiel,2025,,Not Available
39855799,Light-dependent Br-org production in terrestrial plants under acetaminophen stress and the bromination mechanisms mediated by photosystem.,2025,,Not Available
39855045,SW033291 promotes liver regeneration after acetaminophen-induced liver injury in mice.,2025,,Not Available
39853594,"Distribution of pharmaceuticals in marine surface sediment and macroalgae (ulvophyceae) around Mombasa peri-urban creeks and Gazi Bay, Kenya.",2025,,Not Available
39853488,Effect of photobiomodulation on dentin hypersensitivity: a randomized controlled double-blind clinical trial.,2025,,Not Available
39853479,"Paracetamol, its metabolites, and their transfer between maternal circulation and fetal brain in mono- and combination therapies.",2025,,Not Available
39853307,RNase T2 deficiency promotes TLR13-dependent replenishment of tissue-protective Kupffer cells.,2025,,Not Available
39851237,Mechanistic insights of methylcinnamate in improving oxidative stress and inflammation in acetaminophen-induced hepatotoxic mice by upregulating Nrf2 pathway.,2025,,Not Available
39850581,Pharmacological Postoperative Pain Management for Paediatric Dental Extractions Under General Anaesthesia: A Systematic Review.,2025,,Not Available
39850200,"Comparative Analysis of the Postoperative Analgesic Effect of Caudal Ropivacaine Versus Ropivacaine With Nalbuphine in Infra-Umbilical Pediatric Surgeries: A Randomized, Double-Blind Pilot Study.",2024,,Not Available
39848492,Paracetamol prior to catheter balloon insertion for labor induction-A randomized controlled trial.,2025,,Not Available
39848216,What is the most effective method for reducing pain during debonding procedures? A systematic review.,2025,,Not Available
39844888,Therapeutic Levels of Acetaminophen Causing AKI: A Case Report and Literature Review.,2025,,Not Available
39843932,Non-antibiotic pharmaceuticals are toxic against Escherichia coli with no evolution of cross-resistance to antibiotics.,2024,,Not Available
39843512,Cryopreserved human alternatively activated macrophages promote resolution of acetaminophen-induced liver injury in mouse.,2025,,Not Available
39842351,Integrated omics analyses elucidate acetaminophen biodegradation by Enterobacter sp. APAP_BS8.,2025,,Not Available
39841347,Novel pain management strategy for uterine fibroid embolization.,2025,,Not Available
39840538,Examining the Impact of Diet-and-Exercise-Induced Weight Loss on Drug Metabolism and Gastric Emptying in Patients with Obesity.,2025,,Not Available
39839984,Advanced 3D bioprinted liver models with human-induced hepatocytes for personalized toxicity screening.,2025,,Not Available
39838705,Brij 35 inhibited the CYP2E1-mediated metabolism and P-gp mediated transport of paracetamol in rats and ,2025,,Not Available
39836891,Arthritis: Knee and Hip Arthroplasty.,2025,,Not Available
